{
  "event_id": "evt_103",
  "schema_version": "v1alpha1",
  "event_type": "agent.invocation.requested",
  "tenant_id": "tenant_acme",
  "workspace_id": "ws_support",
  "channel": "webchat",
  "channel_instance_id": "webchat_acme_prod",
  "conversation_id": "conv_1",
  "session_id": "sess_1",
  "correlation_id": "corr_1",
  "causation_id": "evt_102",
  "occurred_at": "2026-03-18T10:00:03Z",
  "actor_type": "system",
  "trace_context": {
    "trace_id": "trace_123",
    "span_id": "span_103",
    "parent_span_id": "span_102"
  },
  "payload": {
    "backend": "generic-http-agent",
    "input_event_id": "evt_100"
  }
}